<?xml version="1.0" encoding="UTF-8"?>
<!--Sample XML file generated by XMLSpy v2023 (x64) (http://www.altova.com)-->
<dataTemSystem xmlns:xsi="http://www.w3.org/2001/XMLSchema-instance" xsi:noNamespaceSchemaLocation="iOTTemperatures.xsd">
	<sensorModels>
		<sensorModel>
			<modelCode>String</modelCode>
			<modelName>String</modelName>
			<manufacturer>String</manufacturer>
			<minTemperatureRange>3.141590118408203125</minTemperatureRange>
			<maxTemperatureRange>3.141590118408203125</maxTemperatureRange>
		</sensorModel>
		<sensorModel>
			<modelCode>String</modelCode>
			<modelName>String</modelName>
			<manufacturer>String</manufacturer>
			<minTemperatureRange>3.141590118408203125</minTemperatureRange>
			<maxTemperatureRange>3.141590118408203125</maxTemperatureRange>
		</sensorModel>
	</sensorModels>
	<serverRegions>
		<serverRegion>
			<serverRegionName>String</serverRegionName>
			<sensor>
				<sensorID>0</sensorID>
				<ownerID>0</ownerID>
				<modelCode>String</modelCode>
				<data>
					<date>1957-08-13</date>
					<year>0</year>
					<temperature>3.141590118408203125</temperature>
				</data>
				<data>
					<date>1957-08-13</date>
					<year>0</year>
					<temperature>3.141590118408203125</temperature>
				</data>
				<location>String</location>
			</sensor>
			<sensor>
				<sensorID>0</sensorID>
				<ownerID>0</ownerID>
				<modelCode>String</modelCode>
				<data>
					<date>1957-08-13</date>
					<year>0</year>
					<temperature>3.141590118408203125</temperature>
				</data>
				<data>
					<date>1957-08-13</date>
					<year>0</year>
					<temperature>3.141590118408203125</temperature>
				</data>
				<location>String</location>
			</sensor>
		</serverRegion>
		<serverRegion>
			<serverRegionName>String</serverRegionName>
			<sensor>
				<sensorID>0</sensorID>
				<ownerID>0</ownerID>
				<modelCode>String</modelCode>
				<data>
					<date>1957-08-13</date>
					<year>0</year>
					<temperature>3.141590118408203125</temperature>
				</data>
				<data>
					<date>1957-08-13</date>
					<year>0</year>
					<temperature>3.141590118408203125</temperature>
				</data>
				<location>String</location>
			</sensor>
			<sensor>
				<sensorID>0</sensorID>
				<ownerID>0</ownerID>
				<modelCode>String</modelCode>
				<data>
					<date>1957-08-13</date>
					<year>0</year>
					<temperature>3.141590118408203125</temperature>
				</data>
				<data>
					<date>1957-08-13</date>
					<year>0</year>
					<temperature>3.141590118408203125</temperature>
				</data>
				<location>String</location>
			</sensor>
		</serverRegion>
	</serverRegions>
	<owners>
		<owner>
			<ownerID>String</ownerID>
			<name>String</name>
			<email>String</email>
			<phone>String</phone>
			<sensor>
				<sensorID>0</sensorID>
				<ownerID>0</ownerID>
				<modelCode>String</modelCode>
				<data>
					<date>1957-08-13</date>
					<year>0</year>
					<temperature>3.141590118408203125</temperature>
				</data>
				<data>
					<date>1957-08-13</date>
					<year>0</year>
					<temperature>3.141590118408203125</temperature>
				</data>
				<location>String</location>
			</sensor>
			<country>text</country>
		</owner>
		<owner>
			<ownerID>String</ownerID>
			<name>String</name>
			<email>String</email>
			<phone>String</phone>
			<sensor>
				<sensorID>0</sensorID>
				<ownerID>0</ownerID>
				<modelCode>String</modelCode>
				<data>
					<date>1957-08-13</date>
					<year>0</year>
					<temperature>3.141590118408203125</temperature>
				</data>
				<data>
					<date>1957-08-13</date>
					<year>0</year>
					<temperature>3.141590118408203125</temperature>
				</data>
				<location>String</location>
			</sensor>
			<country>text</country>
		</owner>
	</owners>
</dataTemSystem>
